{
  "schema_version": "rkg.chatbot-golden/1",
  "revision": 1,
  "authority": "non_normative_evaluation_fixture",
  "authoring_status": "source_checked",
  "independent_review_status": "pending",
  "created_date": "2026-10-08",
  "expected_case_count": 50,
  "policy_references": [
    ".aide/policies/eval/EVAL-RKG-QA-001.md",
    ".aide/observability/OBS-RKG-005.md"
  ],
  "binding": {
    "snapshot_ids": "Bind one immutable snapshot per repository in a run manifest before querying a provider.",
    "graph_preflight": "Check required facts against the pinned graph before generation eval. Missing facts are product/indexing gaps, never silently turn answerable cases into passing refusals.",
    "primary_metric": "End-to-end source-backed accuracy uses all 29 standalone answerable cases. Report a separate graph-supported generation score and its denominator if needed.",
    "status_notes": "Expected statuses apply when the indexed snapshot contains the source-backed evidence. Report unavailable graph support separately as coverage gaps; do not rewrite these expected statuses after seeing outputs."
  },
  "scoring": {
    "answerable_accuracy_target": 0.9,
    "citation_coverage_target": 1.0,
    "citation_validity_target": 1.0,
    "graph_contradiction_target": 0,
    "safety_pass_target": 1.0,
    "conversation_pass_target": 1.0,
    "all_required_facts_must_pass": true,
    "verbatim_answer_match": false,
    "readability_checks": [
      "Trả lời thẳng câu hỏi.",
      "Diễn đạt bằng câu tự nhiên, không chuỗi mũi tên.",
      "Không lặp lời dẫn hoặc liệt kê hàm phụ không liên quan.",
      "Phân biệt định nghĩa hiện có với đề xuất thêm/sửa code."
    ]
  },
  "repositories": {
    "soopi": {
      "root": "repo-test/soopi",
      "stack": "Python / FastAPI / SQLAlchemy",
      "source_manifest_sha256": "228dd074e24c180db54d78bf3efcb40800c5bef5afab3256edeae9692d841683",
      "files": {
        "alembic/env.py": "c4a6689f699084e5636963fda975d80226818006ba339f38fda3f13ffb82d679",
        "alembic/versions/0001_initial.py": "71aabc22a4a0f234414f55b297a91631709af287b0a12999e302d54eaec5bcfa",
        "app/__init__.py": "e3b0c44298fc1c149afbf4c8996fb92427ae41e4649b934ca495991b7852b855",
        "app/api/__init__.py": "e3b0c44298fc1c149afbf4c8996fb92427ae41e4649b934ca495991b7852b855",
        "app/api/deps.py": "41a9ecda7631899c7ae11989a5b32cab82c139e19a912291c2295e898a8210fd",
        "app/api/v1/__init__.py": "e3b0c44298fc1c149afbf4c8996fb92427ae41e4649b934ca495991b7852b855",
        "app/api/v1/endpoints/__init__.py": "e3b0c44298fc1c149afbf4c8996fb92427ae41e4649b934ca495991b7852b855",
        "app/api/v1/endpoints/auth.py": "b70f0681f3eb91e6e209375cb4d4a2137cfc4e373d743e2407863846e6a3adc0",
        "app/api/v1/endpoints/cart.py": "4008dd249d51fa5f7ffee76231f8392f54dcbb2e73c6131b4f1446303fbd8b29",
        "app/api/v1/endpoints/categories.py": "0b298bd6c47451a343f3c88e5f0983b06d5fb4379935acd4bcaaea45f84c19e9",
        "app/api/v1/endpoints/orders.py": "8791df90de986a9f465b43d5c7575f57274938b1eddcb3d54063bc1ad979c275",
        "app/api/v1/endpoints/products.py": "0c7ed707171ec9de131fa571f437e3b7125c26357e043f902890c06758d862e1",
        "app/api/v1/endpoints/users.py": "ca336fd5b07abb5f897e19e71a562aa1a559b4ca656ddeda597b46324c788ee8",
        "app/api/v1/router.py": "f2d761799a7486f1f70390c9c7ca4cd1e7c3d12785eb6086eacc96d92a26ad34",
        "app/core/__init__.py": "e3b0c44298fc1c149afbf4c8996fb92427ae41e4649b934ca495991b7852b855",
        "app/core/config.py": "fce0e32459ae4040198bafc7b9311d3fb5424edd2723ae426ed6b7dc76dff789",
        "app/core/database.py": "3207d746c704323f4e0a81f346b16392631d692d42dd06db27e067b89a2f4faf",
        "app/core/exceptions.py": "b0436d6cd28ca551c2f3c3fdd8f97c8ae27394bd7aa6b78f310e741c2ce87608",
        "app/core/security.py": "81271ead02c6a54f882ccfcbc10750b7c639bc81d7eba06b463b2b21e6a8f677",
        "app/expire_orders.py": "da401b161b5af38c56dddc29d4a936725751a94dc17aab56f52f71ded6755e49",
        "app/main.py": "6116ff3608573ff2101ea7b401ed5c5643da47ad8826dbdfa3426b8153353790",
        "app/models/__init__.py": "695f83f4ca03c48752ce60435ac76f4d4bbcca69ce43e40b47343ff58052f7b9",
        "app/models/base.py": "592f893b66e8ec3073e44075719f5cc5f5f4c866594f4c354f80732c4273baba",
        "app/models/cart.py": "444c35b1d8e3fd8c31b31770172894fa91f3ee58035bdbac491fa9eb216adafd",
        "app/models/order.py": "edc7b257699874426350988712a512d2dcaeda984ae6b8c4b897accdea0d8b32",
        "app/models/product.py": "55d4779958819a8a10187817bbd5727c6a6e44aa2c6af8e62e3503ef68a38806",
        "app/models/user.py": "de501d02d02429d33f706b6c907a2addb16cc4896c934d4b52a9c83799f7750f",
        "app/repositories/__init__.py": "e3b0c44298fc1c149afbf4c8996fb92427ae41e4649b934ca495991b7852b855",
        "app/repositories/base.py": "d909abd92a67b6c387c0c5efcf655902275a5df2dc7baea590089a4a5d7dbaba",
        "app/repositories/cart_repo.py": "4392828481918e6fbf4165a6adafb6e03f7f58c5285f37e0009396c527232f77",
        "app/repositories/order_repo.py": "8264cbaf6aeade698473924a53a2932c8b9f27a8cda9e56fe631e4f34a55afd5",
        "app/repositories/payment_repo.py": "d0e6be4f1f0b0f85ac71c2a58bcba6271ad06b608c847787a4fafaea2e6bc8c7",
        "app/repositories/product_repo.py": "d9037d2e183fb762115c43f7e6664d0f331b345ab0832e2bc6eb7c1b541cbf8a",
        "app/repositories/user_repo.py": "1682883a945b9399e29521c809e6970748e13614443c301c45e633f8140d790e",
        "app/schemas/__init__.py": "e3b0c44298fc1c149afbf4c8996fb92427ae41e4649b934ca495991b7852b855",
        "app/schemas/cart.py": "a1c17c5f88311978f1553e1b10da487a0f18aabc0326a22beccc17708a304c8e",
        "app/schemas/common.py": "e31d5c5fef13b452417a057c98e7c24de6a81ef3758fd640d6bde190d7b84f4a",
        "app/schemas/order.py": "ca51b1eaeb8022234a44de0ca4b27b9ab2c223f56154bc6539156f15635cbeff",
        "app/schemas/product.py": "0bcfead4f975c087f308cf95b55954b85eb200e076422cd1708cf6e14ddc51b5",
        "app/schemas/user.py": "34f30ef63ef21257eb481958320a554aa9089210ae7765e8d88f6916947a142c",
        "app/services/__init__.py": "e3b0c44298fc1c149afbf4c8996fb92427ae41e4649b934ca495991b7852b855",
        "app/services/auth_service.py": "66c49eaad715fba9d5475030d12717f326fa79c17a74becd54416ca789aa2162",
        "app/services/cart_service.py": "62bca5e6a002f1b73007fb9931bc9867f9f72171f6d44d8547c3a08279779afe",
        "app/services/order_service.py": "8beb321ff8cf678d1cfddbcd530060ecf13f4673562c7aaa1492c0a5f0a5bcb1",
        "app/services/payment_service.py": "75492d70720115f1f4667ad045559d6775ceed943b4f1dc1658fc45c6ec80865",
        "app/services/product_service.py": "4b8174a9c359546053e161f2890d0c40caf978673d9cd00662ccece7fd62b425",
        "app/services/user_service.py": "aaeb3206b6f847d177f5d88bce2d16dc9f46429ec875391abdae7dfb5beb12cc",
        "tests/conftest.py": "a63d937e8f734784540d2a179faaaf59ac14fcd86cee40815fb7161cbada9458",
        "tests/test_api.py": "c32605d3226e06cd59d49c00871fdd6d9e50c3f1dd3157624804cee707b23c2e",
        "tests/test_cart_auth.py": "b0ce5478501304970e34e6885f8f8173a9d8ce1296f8b691157d57745e3364bb",
        "tests/test_orders.py": "7c7d2ec7b7499aad5e553e2d454af58fd50a77260965f8ad46f626ea46348287",
        "tests/test_payments.py": "51cf2c1da0b84fd0573811a7538480d6cb17f6ed384b3bd3faaec55a739f9fc8",
        "tests/test_schema.py": "bc1f02b8de613c44da1d6f6867561fefb923a3133ded095312e5eece18f7f0db"
      }
    },
    "rkg-fixture-react-ts": {
      "root": "repo-test/rkg-fixture-react-ts",
      "stack": "TypeScript / React Router",
      "source_manifest_sha256": "03ece1f905238f9c97cb955bc32c6840db201cd5861550d59bba9e83df4fcd8e",
      "files": {
        "src/analysis-cases/negative/ambiguousBinding.ts": "e9aafc45b01e16dc3f21306a72810b6f31bbbf5294dbc4fafa8810ac9f286687",
        "src/analysis-cases/negative/dynamicImport.ts": "b6d3347929c54e0edf8ed30162a2b49f3c95e3bd1f97e28124960dbf040b289c",
        "src/analysis-cases/negative/dynamicUrl.ts": "cb9fa688a4abea42921ccc959396205d9264a4c09995aa60ed6360e22dbe5a58",
        "src/analysis-cases/negative/shadowedFetch.ts": "4e5184b085d1ca81e2fed14de561189ebab6f2bbd89abb18066999e7447fe570",
        "src/analysis-cases/positive/aliasedCalls.ts": "dee5aa4f59405b44362d5c9723e1d68d81f91ed65457f84c1ca46edbabc663ef",
        "src/analysis-cases/positive/importedConstants.ts": "38243d868259dc1e98f4c0b8c6ad5024d04f24ef3fd6bd9ea5219ce992a18d49",
        "src/app/App.tsx": "9aacd5b065188e36f1977497b46900856b6dfb22c832bfed4b39b2e5f9441844",
        "src/app/layouts/AdminLayout.tsx": "64ede5221f14c7f0a60bbcc379406f86bc13ab3f49efedd8796994576f6ca901",
        "src/app/layouts/RootLayout.tsx": "fe07aa64d21c0c9b81e6f54f8c67d09bbb15e945c6a759535165de1879c7a8db",
        "src/app/router.test.tsx": "575fe302f4005f10c12219cf3965449286b28d88c3ae60d4272239b80b30f188",
        "src/app/router.tsx": "385a0b2cd9faba41f386e1621375c3371bc0ed33914c8524ae913b767a2d5341",
        "src/app/routes/AdminUsersPage.tsx": "49b3cf4d7c816375256f186d18e18057dc9199ead20281c7ec2947ec32d37130",
        "src/app/routes/DashboardPage.tsx": "0dbbbe779e958a69571772dab3050fabc18be75de32be24ac6c78d9c4fd764ae",
        "src/app/routes/NotFoundPage.tsx": "bdcf86e2ae0bcb142b58821e77b2250d9a2a3b8487454de2d836c5679ba051fd",
        "src/app/routes/OrderDetailPage.tsx": "8479c6663dcce35ff904d0138bc7019ffa44fd8eac6a12ec8a66d1f1052ca41a",
        "src/app/routes/OrderEditPage.tsx": "ba89771cb1a19c35d68b6847d8a3b0c239046cc1e316850f583441caeaddac47",
        "src/app/routes/OrdersPage.tsx": "3e690e9bb6460c1e06315001c851b5dcacf4c26404c1a78b686132a007881659",
        "src/components/LoadingState.tsx": "acdf1e926545fa7a6fe18539d8ce29cfa134199939b14d31be1d192aaf9be807",
        "src/components/OrderStatusBadge.test.tsx": "ad8e20c032a22e22b4e74907c398e9fced2df26913c0b43b5f09931bf528403a",
        "src/components/OrderStatusBadge.tsx": "2a5cf166c8b8a325963820609e196d089c571ffdbbdcf52db3ab115c1441e4b7",